{
  "schema": "sns.governance-delegation.v1",
  "delegation_id": "DELEG-20260902-HUMAN-SEPTEMBER-TRIAGE-V1",
  "period": "2026-09",
  "authority": "monthly-governance",
  "authorized_loop": "daily-governance-triage",
  "allowed_action_types": [
    "refine_existing"
  ],
  "allowed_quest_ids": [
    "QST-ARCI-0001"
  ],
  "authorized_implementation_surfaces": [
    "configs/**",
    "experiments/**",
    "tests/**",
    "outputs/**"
  ],
  "forbidden_surfaces": [
    "automation/contracts/**",
    "automation/schemas/**",
    "automation/state_ownership.json",
    "automation/delegations/**",
    "calendar/consolidated_beliefs.json",
    "calendar/monthly/**",
    "memory/**",
    "quests/active/**",
    "quests/completed/**",
    "quests/proposed/**",
    "quests/blocked/**",
    ".github/**",
    "src/**"
  ],
  "max_authorizations_per_run": 1,
  "max_pull_requests_per_authorization": 1,
  "max_run_receipts_per_authorization": 1,
  "required_checks": [
    "python -m pytest -q tests/test_automation_*.py",
    "python -m automation.cli validate-repository"
  ],
  "recorded_at": "2026-09-02T18:58:07.761521Z",
  "expires_at": "2026-09-30T23:59:59Z",
  "rationale": "Published by the accepted September Monthly constitutional transition under explicit human approval recorded in Issue #65 comment 5514504198. One bounded refine_existing lane is available only for the already-active QST-ARCI-0001 synthetic-target sensitivity slice. The envelope grants no queue, quest membership, belief, memory, contract, schema, scientific-architecture, scheduler, or external/public authority."
}
